{
  "run_id": "20261011-132527-reference-holdout",
  "started_at": "2026-10-11T13:25:27-03:00",
  "finished_at": "2026-10-11T13:25:44-03:00",
  "status": "complete",
  "subset": "holdout",
  "answer_key_version": "2026-10-11.1",
  "answer_key_hash": "ea9b78ffabf4835a082c6ff68fc689e69a6d77e7dd6832928e4939b7f8058b3f",
  "config": {
    "experiment": "section_hybrid",
    "strategy": "section",
    "search_type": "hybrid",
    "match_count": 4,
    "match_threshold": 0.0,
    "use_hyde": false,
    "chunk_size": 1200,
    "chunk_overlap": 100,
    "vector_k": 2,
    "bm25_k": 2,
    "final_k": 4,
    "chat_model": "llama3",
    "embedding_model": "nomic-embed-text",
    "temperature": 0,
    "seed": 42,
    "num_ctx": null,
    "prompt_hash": "3255edbf0214b35c",
    "kb_hash": "617e359d14ee6cd1",
    "kb_chunk_count": 11,
    "judge_model": null,
    "git_commit": "824659f",
    "git_dirty": true
  },
  "repeat": 1,
  "results": [
    {
      "item_id": "cleaning-result-01",
      "answer": "You'll see the result of a cleaning immediately, from the very first session. Would you like to schedule an assessment?",
      "retrieved": {
        "vector": [
          {
            "content": "Dental Cleaning — The First Step Toward a Healthy Smile\nWhat you gain:\n- An immediate feeling of a clean mouth\n- Fresher breath\n- Prevention of more serious problems (saving money in the future)\nHow it works: Removal of plaque and tartar using ultrasound, followed by polishing.\nDuration: 30–50 minutes   |   Price: $40–$85\nResult: Immediate, from the very first session",
            "rank": 1,
            "score": 0.684185767336603,
            "similarity": 0.684185767336603
          },
          {
            "content": "Schedule Your Assessment Today\nThe longer you wait, the bigger the problem—and the higher the cost—may become. At DentalSafe, you can address\neverything from basic care to comprehensive treatments with safety and predictable outcomes.",
            "rank": 2,
            "score": 0.6167473742564091,
            "similarity": 0.6167473742564091
          }
        ],
        "bm25": [
          {
            "content": "Dental Cleaning — The First Step Toward a Healthy Smile\nWhat you gain:\n- An immediate feeling of a clean mouth\n- Fresher breath\n- Prevention of more serious problems (saving money in the future)\nHow it works: Removal of plaque and tartar using ultrasound, followed by polishing.\nDuration: 30–50 minutes   |   Price: $40–$85\nResult: Immediate, from the very first session",
            "rank": 1,
            "score": 2.3421308368248406,
            "similarity": 0.684185767336603
          },
          {
            "content": "Teeth Whitening — Whiter Teeth in Just a Few Days\nIdeal for people who want to:\n- Improve their appearance quickly\n- Remove stains from coffee, wine, or cigarettes\n- Feel more confident when smiling\nHow it works: Professional whitening gel applied in the clinic or used at home under supervision.\nDuration: In-office: same day | Full treatment: up to 14 days   |   Price: $180–$450\nResult: Up to 8 shades whiter, with results lasting up to 3 years",
            "rank": 2,
            "score": 2.282633048937929,
            "similarity": 0.6034592112433153
          }
        ],
        "fused": [
          {
            "content": "Dental Cleaning — The First Step Toward a Healthy Smile\nWhat you gain:\n- An immediate feeling of a clean mouth\n- Fresher breath\n- Prevention of more serious problems (saving money in the future)\nHow it works: Removal of plaque and tartar using ultrasound, followed by polishing.\nDuration: 30–50 minutes   |   Price: $40–$85\nResult: Immediate, from the very first session",
            "rank": 1,
            "score": 0.03278688524590164,
            "similarity": 0.684185767336603
          },
          {
            "content": "Schedule Your Assessment Today\nThe longer you wait, the bigger the problem—and the higher the cost—may become. At DentalSafe, you can address\neverything from basic care to comprehensive treatments with safety and predictable outcomes.",
            "rank": 2,
            "score": 0.016129032258064516,
            "similarity": 0.6167473742564091
          },
          {
            "content": "Teeth Whitening — Whiter Teeth in Just a Few Days\nIdeal for people who want to:\n- Improve their appearance quickly\n- Remove stains from coffee, wine, or cigarettes\n- Feel more confident when smiling\nHow it works: Professional whitening gel applied in the clinic or used at home under supervision.\nDuration: In-office: same day | Full treatment: up to 14 days   |   Price: $180–$450\nResult: Up to 8 shades whiter, with results lasting up to 3 years",
            "rank": 3,
            "score": 0.016129032258064516,
            "similarity": 0.6034592112433153
          }
        ]
      },
      "retrieval": {
        "vector": {
          "hit": true,
          "recall": 1.0,
          "mrr": 1.0,
          "context_precision": 0.5,
          "anchored": true
        },
        "bm25": {
          "hit": true,
          "recall": 1.0,
          "mrr": 1.0,
          "context_precision": 0.5,
          "anchored": true
        },
        "fused": {
          "hit": true,
          "recall": 1.0,
          "mrr": 1.0,
          "context_precision": 0.3333333333333333,
          "anchored": true
        }
      },
      "facts": [
        {
          "label": "result",
          "found": true
        }
      ],
      "unexpected_values": [],
      "ungrounded_values": [],
      "abstained": false,
      "rule_violations": [],
      "judge": null,
      "latency_s": 0.664,
      "passed": true,
      "cause": null,
      "flags": []
    },
    {
      "item_id": "whitening-duration-02",
      "answer": "The full teeth whitening treatment takes up to 14 days. Would you like to schedule an assessment?",
      "retrieved": {
        "vector": [
          {
            "content": "Teeth Whitening — Whiter Teeth in Just a Few Days\nIdeal for people who want to:\n- Improve their appearance quickly\n- Remove stains from coffee, wine, or cigarettes\n- Feel more confident when smiling\nHow it works: Professional whitening gel applied in the clinic or used at home under supervision.\nDuration: In-office: same day | Full treatment: up to 14 days   |   Price: $180–$450\nResult: Up to 8 shades whiter, with results lasting up to 3 years",
            "rank": 1,
            "score": 0.7788409370121585,
            "similarity": 0.7788409370121585
          },
          {
            "content": "Dental Cleaning — The First Step Toward a Healthy Smile\nWhat you gain:\n- An immediate feeling of a clean mouth\n- Fresher breath\n- Prevention of more serious problems (saving money in the future)\nHow it works: Removal of plaque and tartar using ultrasound, followed by polishing.\nDuration: 30–50 minutes   |   Price: $40–$85\nResult: Immediate, from the very first session",
            "rank": 2,
            "score": 0.6539818939687853,
            "similarity": 0.6539818939687853
          }
        ],
        "bm25": [
          {
            "content": "Teeth Whitening — Whiter Teeth in Just a Few Days\nIdeal for people who want to:\n- Improve their appearance quickly\n- Remove stains from coffee, wine, or cigarettes\n- Feel more confident when smiling\nHow it works: Professional whitening gel applied in the clinic or used at home under supervision.\nDuration: In-office: same day | Full treatment: up to 14 days   |   Price: $180–$450\nResult: Up to 8 shades whiter, with results lasting up to 3 years",
            "rank": 1,
            "score": 5.819415241177785,
            "similarity": 0.7788409370121585
          },
          {
            "content": "Tooth Extraction — Fast, Safe Relief\nRecommended for:\n- Severely damaged teeth\n- Impacted wisdom teeth\n- Advanced infections\nDuration: 20–60 minutes   |   Price: Simple extraction: $50–$90 | Wisdom tooth: $140–$400\nResult: Pain relief and prevention of complications\nRecovery: 3–7 days",
            "rank": 2,
            "score": 0.9708515686262964,
            "similarity": 0.5607861323287422
          }
        ],
        "fused": [
          {
            "content": "Teeth Whitening — Whiter Teeth in Just a Few Days\nIdeal for people who want to:\n- Improve their appearance quickly\n- Remove stains from coffee, wine, or cigarettes\n- Feel more confident when smiling\nHow it works: Professional whitening gel applied in the clinic or used at home under supervision.\nDuration: In-office: same day | Full treatment: up to 14 days   |   Price: $180–$450\nResult: Up to 8 shades whiter, with results lasting up to 3 years",
            "rank": 1,
            "score": 0.03278688524590164,
            "similarity": 0.7788409370121585
          },
          {
            "content": "Dental Cleaning — The First Step Toward a Healthy Smile\nWhat you gain:\n- An immediate feeling of a clean mouth\n- Fresher breath\n- Prevention of more serious problems (saving money in the future)\nHow it works: Removal of plaque and tartar using ultrasound, followed by polishing.\nDuration: 30–50 minutes   |   Price: $40–$85\nResult: Immediate, from the very first session",
            "rank": 2,
            "score": 0.016129032258064516,
            "similarity": 0.6539818939687853
          },
          {
            "content": "Tooth Extraction — Fast, Safe Relief\nRecommended for:\n- Severely damaged teeth\n- Impacted wisdom teeth\n- Advanced infections\nDuration: 20–60 minutes   |   Price: Simple extraction: $50–$90 | Wisdom tooth: $140–$400\nResult: Pain relief and prevention of complications\nRecovery: 3–7 days",
            "rank": 3,
            "score": 0.016129032258064516,
            "similarity": 0.5607861323287422
          }
        ]
      },
      "retrieval": {
        "vector": {
          "hit": true,
          "recall": 1.0,
          "mrr": 1.0,